{
  "library": "Excel",
  "version": "16.0",
  "metadata": {
    "namespace": "Microsoft.Office.Interop.Excel",
    "typeLibraryGuid": "{00020813-0000-0000-C000-000000000046}",
    "sourceInherits": ["IDispatch"]
  },
  "enums": [
    {
      "name": "XlCalculation",
      "values": [
        {
          "name": "xlCalculationAutomatic",
          "value": -4105
        },
        {
          "name": "xlCalculationManual",
          "value": -4135
        }
      ]
    },
    {
      "name": "XlCutCopyMode",
      "values": [
        {
          "name": "xlCopy",
          "value": 1
        },
        {
          "name": "xlCut",
          "value": 2
        }
      ]
    },
    {
      "name": "XlApplicationInternational",
      "values": [
        {
          "name": "xlDecimalSeparator",
          "value": 3
        },
        {
          "name": "xlThousandsSeparator",
          "value": 4
        },
        {
          "name": "xlListSeparator",
          "value": 5
        }
      ]
    },
    {
      "name": "XlFileFormat",
      "values": [
        {
          "name": "xlOpenXMLWorkbook",
          "value": 51
        },
        {
          "name": "xlOpenXMLWorkbookMacroEnabled",
          "value": 52
        },
        {
          "name": "xlOpenXMLTemplateMacroEnabled",
          "value": 53
        },
        {
          "name": "xlOpenXMLTemplate",
          "value": 54
        },
        {
          "name": "xlOpenXMLStrictWorkbook",
          "value": 61
        }
      ]
    },
    {
      "name": "XlSheetVisibility",
      "values": [
        {
          "name": "xlSheetVisible",
          "value": -1
        },
        {
          "name": "xlSheetHidden",
          "value": 0
        },
        {
          "name": "xlSheetVeryHidden",
          "value": 2
        }
      ]
    }
  ],
  "interfaces": [
    {
      "name": "Application",
      "kind": "dispatch",
      "metadata": {
        "iid": "{000208D5-0000-0000-C000-000000000046}",
        "sourceInherits": ["IDispatch"]
      },
      "members": [
        {
          "name": "Workbooks",
          "memberKind": "property",
          "returnType": {
            "kind": "interface",
            "name": "Workbooks",
            "aliasOf": "Excel.Workbooks"
          },
          "support": "stub",
          "notes": "Pinned template slot for extracted Application.Workbooks member.",
          "metadata": {
            "capture": {
              "origins": [
                {
                  "kind": "property_get",
                  "sourceInterface": "Application",
                  "sourceMember": "Workbooks",
                  "dispId": 572
                }
              ],
              "typeInfo": {
                "kind": "interface",
                "name": "Workbooks",
                "aliasOf": "Excel.Workbooks"
              }
            }
          }
        },
        {
          "name": "Worksheets",
          "memberKind": "property",
          "returnType": {
            "kind": "interface",
            "name": "Worksheets",
            "aliasOf": "Excel.Worksheets"
          },
          "support": "stub",
          "metadata": {
            "capture": {
              "origins": [
                {
                  "kind": "property_get",
                  "sourceInterface": "Application",
                  "sourceMember": "Worksheets"
                }
              ],
              "typeInfo": {
                "kind": "interface",
                "name": "Worksheets",
                "aliasOf": "Excel.Worksheets"
              }
            }
          }
        },
        {
          "name": "Sheets",
          "memberKind": "property",
          "returnType": {
            "kind": "interface",
            "name": "Worksheets",
            "aliasOf": "Excel.Sheets"
          },
          "support": "stub",
          "metadata": {
            "capture": {
              "origins": [
                {
                  "kind": "property_get",
                  "sourceInterface": "Application",
                  "sourceMember": "Sheets"
                }
              ],
              "typeInfo": {
                "kind": "interface",
                "name": "Worksheets",
                "aliasOf": "Excel.Sheets"
              }
            }
          }
        },
        {
          "name": "ActiveWorkbook",
          "memberKind": "property",
          "returnType": {
            "kind": "interface",
            "name": "Workbook",
            "nullable": true,
            "aliasOf": "Excel.Workbook"
          },
          "support": "stub",
          "metadata": {
            "capture": {
              "origins": [
                {
                  "kind": "property_get",
                  "sourceInterface": "Application",
                  "sourceMember": "ActiveWorkbook",
                  "dispId": 142
                }
              ],
              "typeInfo": {
                "kind": "interface",
                "name": "Workbook",
                "nullable": true,
                "aliasOf": "Excel.Workbook"
              }
            }
          }
        },
        {
          "name": "ActiveSheet",
          "memberKind": "property",
          "returnType": {
            "kind": "interface",
            "name": "Worksheet",
            "nullable": true,
            "aliasOf": "Excel.Worksheet"
          },
          "support": "stub",
          "metadata": {
            "capture": {
              "origins": [
                {
                  "kind": "property_get",
                  "sourceInterface": "Application",
                  "sourceMember": "ActiveSheet",
                  "dispId": 246
                }
              ],
              "typeInfo": {
                "kind": "interface",
                "name": "Worksheet",
                "nullable": true,
                "aliasOf": "Excel.Worksheet"
              }
            }
          }
        },
        {
          "name": "ActiveCell",
          "memberKind": "property",
          "returnType": {
            "kind": "interface",
            "name": "Range",
            "nullable": true,
            "aliasOf": "Excel.Range"
          },
          "support": "stub",
          "metadata": {
            "capture": {
              "origins": [
                {
                  "kind": "property_get",
                  "sourceInterface": "Application",
                  "sourceMember": "ActiveCell"
                }
              ],
              "typeInfo": {
                "kind": "interface",
                "name": "Range",
                "nullable": true,
                "aliasOf": "Excel.Range"
              }
            }
          }
        },
        {
          "name": "Selection",
          "memberKind": "property",
          "returnType": {
            "kind": "interface",
            "name": "Range",
            "nullable": true,
            "aliasOf": "Excel.Range"
          },
          "support": "stub",
          "metadata": {
            "capture": {
              "origins": [
                {
                  "kind": "property_get",
                  "sourceInterface": "Application",
                  "sourceMember": "Selection"
                }
              ],
              "typeInfo": {
                "kind": "interface",
                "name": "Range",
                "nullable": true,
                "aliasOf": "Excel.Range"
              }
            }
          }
        },
        {
          "name": "Name",
          "memberKind": "property",
          "returnType": {
            "kind": "primitive",
            "name": "string",
            "aliasOf": "BSTR"
          },
          "support": "stub",
          "metadata": {
            "capture": {
              "origins": [
                {
                  "kind": "property_get",
                  "sourceInterface": "Application",
                  "sourceMember": "Name"
                }
              ],
              "typeInfo": {
                "kind": "primitive",
                "name": "string",
                "aliasOf": "BSTR"
              }
            }
          }
        },
        {
          "name": "Version",
          "memberKind": "property",
          "returnType": {
            "kind": "primitive",
            "name": "string",
            "aliasOf": "BSTR"
          },
          "support": "stub",
          "metadata": {
            "capture": {
              "origins": [
                {
                  "kind": "property_get",
                  "sourceInterface": "Application",
                  "sourceMember": "Version"
                }
              ],
              "typeInfo": {
                "kind": "primitive",
                "name": "string",
                "aliasOf": "BSTR"
              }
            }
          }
        },
        {
          "name": "UserName",
          "memberKind": "property",
          "access": "readwrite",
          "returnType": {
            "kind": "primitive",
            "name": "string",
            "aliasOf": "BSTR"
          },
          "support": "stub",
          "metadata": {
            "capture": {
              "origins": [
                {
                  "kind": "property_get",
                  "sourceInterface": "Application",
                  "sourceMember": "UserName"
                },
                {
                  "kind": "property_set",
                  "sourceInterface": "Application",
                  "sourceMember": "UserName"
                }
              ],
              "typeInfo": {
                "kind": "primitive",
                "name": "string",
                "aliasOf": "BSTR"
              }
            }
          }
        },
        {
          "name": "DefaultFilePath",
          "memberKind": "property",
          "access": "readwrite",
          "returnType": {
            "kind": "primitive",
            "name": "string",